{
  "$schema": "https://json-schema.org/draft/2020-12/schema",
  "$id": "https://github.com/joshualikaist/Babdoduk/schemas/ggongbab-feed.schema.json",
  "title": "Free-food feed: data/ggongbab/latest.json",
  "description": "Written by scripts/refresh_ggongbab.py (ggongbab.exporter.build_payload) and read by ggongbab.html and the home calendar. Every event field is reviewed for privacy: a new key needs a privacy review before it is added here and to validate_content.GG_EVENT_SCHEMA. validate_content.py adds the rules a schema cannot state (expiry, explicit food, private text and URL patterns).",
  "type": "object",
  "required": ["generatedAt", "timezone", "count", "events"],
  "additionalProperties": false,
  "properties": {
    "schemaVersion": {"type": "integer", "const": 1},
    "generatedAt": {"$ref": "#/$defs/kstTime"},
    "timezone": {"const": "Asia/Seoul"},
    "count": {"type": "integer", "minimum": 0},
    "events": {"type": "array", "items": {"$ref": "#/$defs/event"}},
    "_preview": {
      "description": "Local preview only (.local/ggongbab-preview.json): numeric diagnostics, never text.",
      "type": "object",
      "additionalProperties": {"type": "number"}
    }
  },
  "$defs": {
    "kstTime": {"type": "string", "pattern": "^\\d{4}-\\d{2}-\\d{2}T\\d{2}:\\d{2}:\\d{2}\\+09:00$"},
    "kstTimeOrNull": {"type": ["string", "null"], "pattern": "^\\d{4}-\\d{2}-\\d{2}T\\d{2}:\\d{2}:\\d{2}\\+09:00$"},
    "tri": {"enum": ["true", "false", "unknown"]},
    "urlOrEmpty": {"type": ["string", "null"], "pattern": "^(https?://[^\\s/]+\\S*)?$"},
    "event": {
      "type": "object",
      "required": ["id", "title", "summary", "startAt", "endAt", "dateText", "timeText", "location", "food",
                   "organizer", "eligibility", "registration", "confidence", "sources"],
      "additionalProperties": false,
      "properties": {
        "id": {"type": "string", "pattern": "^[A-Za-z0-9][A-Za-z0-9_.:-]{0,127}$"},
        "title": {"type": "string", "minLength": 1},
        "summary": {"type": "string"},
        "startAt": {"$ref": "#/$defs/kstTime"},
        "endAt": {"$ref": "#/$defs/kstTimeOrNull"},
        "dateText": {"type": "string"},
        "timeText": {"type": "string"},
        "location": {"$ref": "#/$defs/location"},
        "food": {"$ref": "#/$defs/food"},
        "organizer": {"type": "string"},
        "eligibility": {"type": "string"},
        "registration": {
          "type": "object",
          "required": ["required", "deadline", "url"],
          "additionalProperties": false,
          "properties": {
            "required": {"$ref": "#/$defs/tri"},
            "deadline": {"$ref": "#/$defs/kstTimeOrNull"},
            "url": {"$ref": "#/$defs/urlOrEmpty"}
          }
        },
        "confidence": {"type": "number", "minimum": 0, "maximum": 1},
        "giveaway": {
          "description": "Present only when participants can win or receive a prize or gift (owner decision 2026-10-14); the page marks the listing with a gift and keeps it out of the free-food counts.",
          "type": "object",
          "required": ["provided", "description"],
          "additionalProperties": false,
          "properties": {
            "provided": {"const": "true"},
            "description": {"type": "string"}
          }
        },
        "sources": {"type": "array", "items": {"$ref": "#/$defs/source"}},
        "sessions": {
          "description": "Optional. Every day or session of a multi-day event, in order, 2 to 14 items; the first starts at startAt and none ends after endAt (2026-10-18). Read back from the stored AI parse (scripts/ggongbab/parse_extras.py).",
          "type": "array", "minItems": 2, "maxItems": 14, "items": {"$ref": "#/$defs/session"}
        },
        "audience": {
          "description": "Optional. Who the event is for. basis 'stated': the source says so; 'inferred': only under the strict rule of the extraction prompt, shown with an 'estimated' mark (2026-10-18).",
          "type": "object",
          "required": ["text", "basis"],
          "additionalProperties": false,
          "properties": {
            "text": {"type": "string", "minLength": 1, "maxLength": 60},
            "basis": {"enum": ["stated", "inferred"]}
          }
        }
      }
    },
    "session": {
      "type": "object",
      "required": ["startAt", "endAt"],
      "additionalProperties": false,
      "properties": {
        "startAt": {"$ref": "#/$defs/kstTime"},
        "endAt": {"$ref": "#/$defs/kstTimeOrNull"},
        "location": {"$ref": "#/$defs/location"},
        "foodDescription": {"type": "string"}
      }
    },
    "location": {
      "type": "object",
      "required": ["name", "building", "room"],
      "additionalProperties": false,
      "properties": {
        "name": {"type": "string"},
        "building": {"type": "string"},
        "room": {"type": "string"}
      }
    },
    "food": {
      "type": "object",
      "required": ["provided", "type", "description"],
      "additionalProperties": false,
      "properties": {
        "provided": {"$ref": "#/$defs/tri"},
        "type": {"enum": ["meal", "lunchbox", "snack", "refreshment", "beverage", "coupon", "other", "unknown"]},
        "description": {"type": "string"},
        "source": {"description": "Where the food evidence was read: the text, or only an attached poster image.",
                   "enum": ["text", "poster"]}
      }
    },
    "source": {
      "description": "Generic source labels only. A URL is kept for public notices (kaist_public, manual) alone.",
      "type": "object",
      "required": ["type", "name"],
      "additionalProperties": false,
      "properties": {
        "type": {"enum": ["dooray", "dooray_mailbox", "kaist_public", "manual", "portal"]},
        "name": {"enum": ["Dooray", "Dooray 메일함", "KAIST 공지", "Manual", "KAIST Portal"]},
        "url": {"$ref": "#/$defs/urlOrEmpty"}
      }
    }
  }
}
